Ticket ID,Error Name,Ticket link,Ticket type,POI name,Last Editor Notes,Last Editor Resolution,L1 Resolution,L1 Markings,L2 Resolution,L2 Markings,Customer comment,Suggested fields,Edited fields,Spam Customer Suggestions,Procedural marking?,Other markings made along with procedural marking?,All customer-suggested fields edited?,All customer-suggested fields have a corresponding dependent edit?,Edits made to all other fields QC marked?,Manual review - Name,Manual review - Date,Are customer issues resolved?,Any attribute errors remain on the POI?,Are there still discrepancies between research indicators and POI data?,Manual review comment,Automated warnings,Automated review comment,Automated update needed?,Correlation: P-W,Correlation: S-W,Correlation: T-X
180516741205458947,Failing To Provide 1 Strong Or 2 Medium Indicators,https://apollo.geo.apple.com/tickets/kittyhawk-sig/180516741205458947,POI Datascience (ApplePay New Contactless),[New] The Goods Spot,"
No Indicators Found | 
REJECT: Not Enough Information - Customer didn't provide enough information |",Rejection Reason POI - Not Enough Information,Rejected,Field New POI Error - Failing To Create A New POI | Closing Resolutions - Failing To Select Complete | Research And Comments Error - Failing To Provide 1 Strong Or 2 Medium Indicators,Rejected,,Please review if we are missing a POI or a Virtual POI and create it with Merchant Data per policy.,Geocode | Modern Category | Comment,New POI | Name | Address | Geocode | Modern Category | Good-to-know Tag,Geocode,Failing To Select Complete | Failing To Provide 1 Strong Or 2 Medium Indicators,Failing To Create A New POI,Yes,N/A,Yes,Josh,06/03/2025,Yes,No,No,Editor properly added the new POI per L1 markings: https://confluence.sd.apple.com/display/OPS/Apple+Pay+New+POIs,New POI added! Offline QC Rejected ticket! No Original col to pull previous Editor Edits from! Unable to determine field applicability of customer comment present!,"Note GEMINI ticket if could add a col for ""Source"" output

SKIP NON-JANA (will filter out beforehand next time)

still good example showing need to fix ""Edits made to all other fields QC marked"" to account for New POI edit.
FIXED this and spam col false positive",Done,1,0,1
180516830137286659,Failing To Provide 1 Strong Or 2 Medium Indicators,https://apollo.geo.apple.com/tickets/kittyhawk-sig/180516830137286659,POI Change Details (Unspecified),Pamukspor Spor Merkezi,"
[pafe_processor_todo_hours] Todo has reached minimum lifespan in NEEDS_TRIAGE status",Rejection Reason POI - Policy Violation,Rejected,Research And Comments Error - Failing To Provide 1 Strong Or 2 Medium Indicators,Rejected,Research And Comments Error - Failing To Provide 1 Strong Or 2 Medium Indicators,,Hours,,N/A,Failing To Provide 1 Strong Or 2 Medium Indicators,,No,No,Yes,Alexander,06/04/2025,Yes,No,No,"Editor failed to provide indicators, which were instead provided by L1. Not enough info to support customer suggested change for hours. 

Editor disputed action but dispute fell in favor if L1 QC. Editor then accepted dispute. No other markings. ",Offline QC Disputed Rejected ticket! Offline QC Rejected ticket!,"S+W No-Yes relation:

Editor rejected suggested change, which was the correct action but for the wrong reason. Data on POI is intact. ",No,0,1,1
185021048004024710,Failing To Provide 1 Strong Or 2 Medium Indicators,https://apollo.geo.apple.com/tickets/kittyhawk-sig/185021048004024710,POI Morrow (Morrow Maintenance New),Paninoteca Le Rose,"
This todo has been processed using translator |
Verified via 3rd Party Sources: News/Wikipedia/Internet searches | Link: https://m.yelp.com/biz/paninoteca-le-rose-gardone-riviera-2 |
found 1 medium indicator |
REJECT: Not Enough Information - Customer didn't provide enough information |Error Attribute :Failing To Provide 1 Strong Or 2 Medium Indicators",Rejection Reason POI - Not Enough InformationAcknowledge the QC Marked Error,Rejected,Closing Resolutions - Failing To Select Already Correct | Research And Comments Error - Failing To Provide 1 Strong Or 2 Medium IndicatorsREJECT: Not Enough Information - Customer didn't provide enough information,Rejected,Error Attribute :Failing To Provide 1 Strong Or 2 Medium Indicators,"

Verified existence no edits made the resolution should be reject already correct | Kindly check and update",,,N/A,Failing To Select Already Correct | Failing To Provide 1 Strong Or 2 Medium Indicators,,Yes,N/A,Yes,Elvis,06/03/2025,Yes,No,No,Duplicate | Failing to select reject already correct,"
Offline QC Rejected ticket! No Corrections col! 'is wrong' suggestions only!","Josh: ""Failing To Select Already Correct"" actually is a procedural marking, just not one included in the radar, I think we need to account for all after all even if trying to filter by the ones per radar",Done,1,1,1
185020401536991340,Failing To Provide 1 Strong Or 2 Medium Indicators,https://apollo.geo.apple.com/tickets/kittyhawk-sig/185020401536991340,POI Change Details (Unspecified),Gourmet Food Park,"
[pafe_processor_todo_hours] Todo has reached minimum lifespan in NEEDS_TRIAGE status",Rejection Reason POI - Not Enough Information,Approved,,Rejected,Research And Comments Error - Failing To Provide 1 Strong Or 2 Medium Indicators,"

",Hours,,N/A,Failing To Provide 1 Strong Or 2 Medium Indicators,,No,No,Yes,William,06/03/2025,Yes,No,No,Editor failed to provide indicators in notes.. no other markings.,"
Offline QA QC Rejected ticket! Flagged/Escalated ticket!","QC only marked for failing to provide enough indicators. automation will automatically skip since no other markings.


Alex: S+W No-Yes relation:
Editor rejected suggested change, which was the correct action but for the wrong reason. Data on POI is intact. ",Done,0,1,1
189524933164924934,Failing To Provide 1 Strong Or 2 Medium Indicators,https://apollo.geo.apple.com/tickets/kittyhawk-sig/189524933164924934,POI Morrow (Morrow Maintenance New),Malafemmena Caffe,"
“ This ToDo has been processed using translator “ |
Only one indicator found |
Verified via 3rd Party Sources: News/Wikipedia/Internet searches | Link: https://fr.restaurantguru.com/Bar-Malafemmena-Parma |
REJECT: Not Enough Information - Customer didn't provide enough information |",Rejection Reason POI - Not Enough Information,Rejected,Field Core Hours Error - Hours Not Matching Or Incorrect Hours | Closing Resolutions - Failing To Select Complete | Research And Comments Error - Failing To Provide 1 Strong Or 2 Medium Indicators,,,"

",,,N/A,Failing To Select Complete | Failing To Provide 1 Strong Or 2 Medium Indicators,Hours Not Matching Or Incorrect Hours,Yes,N/A,No,Josh,06/04/2025,No,Yes,Yes,,"
Offline QC Rejected ticket! No Corrections col! 'is wrong' suggestions only!",SKIP NON-JANA,,0,1,1
180518049594474496,Failing To Provide 1 Strong Or 2 Medium Indicators,https://apollo.geo.apple.com/tickets/kittyhawk-sig/180518049594474496,POI Change Details (High Priority),Speisesaal,"
sent to editor upon one or more processors' decision (poi_rap_pin_fsm::f3965a4f-136c-47b0-b9d2-7f214a3eb400)",Completion Reason POI - POI Changed,Rejected,Research And Comments Error - Failing To Provide 1 Strong Or 2 Medium Indicators,,,"

",Geocode,Geocode,N/A,Failing To Provide 1 Strong Or 2 Medium Indicators,,Yes,Yes,Yes,Alexander,06/04/2025,Yes,No,No,Editor failed to provide indicators. L1 provided them. Editor did not respond with accepted and instead proceeded to post random empty indicator link snippets. ,"
Offline QC Rejected ticket!","Are we able to glean anything meaningful from whether an editor has officially ""Accepted"" a QC rejection about the ticket? If so, this ticket would fail as an outlier case. ",Unsure,1,0,1
198531457455489024,Failing To Provide 1 Strong Or 2 Medium Indicators,https://apollo.geo.apple.com/tickets/kittyhawk-sig/198531457455489024,POI Change Details (Unspecified),Red Fish Teriyaki Asian Express,"
[pafe_processor_todo_hours] Setting to UNREVIEWED because todo has comment",Completion Reason POI - POI Changed,Rejected,Field URL Error - Hours Listing Issue | Research And Comments Error - Failing To Provide 1 Strong Or 2 Medium Indicators | Research And Comments Error - Insufficient Comments Provided,Rejected,,"
Sundays are now open",Hours | Comment,Hours,N/A,Hours Listing Issue | Failing To Provide 1 Strong Or 2 Medium Indicators | Insufficient Comments Provided,,Yes,Yes,Yes,Elvis,06/03/2025,Yes,No,No,OW provides hours,"
Offline QC Rejected ticket! 'is wrong' suggestions only! Unable to determine field applicability of customer comment present!",,Unsure,1,0,1
194029317484717847,Failing To Provide 1 Strong Or 2 Medium Indicators,https://apollo.geo.apple.com/tickets/kittyhawk-sig/194029317484717847,POI Change Details (Unspecified),Pasteur Hayvan Hastanesi,"
Cloned POI for new place | 
ToDo Proceeded using Language Translator | 
Customer suggestions updated as per policy | Complete |
Verified via Official Website | Link: 
justification : Customer suggestions updated as per policy |",Completion Reason POI - POI Added,Rejected,Research And Comments Error - Failing To Provide 1 Strong Or 2 Medium Indicators,,,"

",Name,New POI | Name | URL | Geocode | Phone | Hours | Modern Category,N/A,Failing To Provide 1 Strong Or 2 Medium Indicators,,Yes,Yes,Yes,William,06/03/2025,Yes,No,No,Editor failed to provide indicators in notes.. no other markings.,"
Offline QC Rejected ticket! New POI added! 1 ""Removed"" Name suggestions present!",QC only marked for failing to provide enough indicators. automation will automatically skip since no other markings.,Done,1,0,1
189524985940808586,Failing To Provide 1 Strong Or 2 Medium Indicators,https://apollo.geo.apple.com/tickets/kittyhawk-sig/189524985940808586,POI Morrow (Morrow Maintenance New),Durga Supar Market,"
Special Project: Lookaround study | 
no indicators found with the name and existing address |
cannot verify the existence hence cannot make curation |
No panos in lookaround view hence cannot verify the storefront |
REJECT: Not Enough Information - Customer didn't provide enough information |",Rejection Reason POI - Not Enough Information,Rejected,Field Name Error - Language Or Country Code Guideline Not Followed | Closing Resolutions - Failing To Select Complete | Research And Comments Error - Failing To Provide 1 Strong Or 2 Medium Indicators,,,"
Fully curate each POI and follow full curation Morrow Policy",Comment,Name | Address,N/A,Failing To Select Complete | Failing To Provide 1 Strong Or 2 Medium Indicators,Language Or Country Code Guideline Not Followed,Yes,N/A,Yes,Josh,06/04/2025,Yes,No,No,"2 procedural markings, editor actually edited address too despite QC not marking, acceptable as unclear if Shop No. means unit/sub-premise per se","
Offline QC Rejected ticket! No Corrections col! 'is wrong' suggestions only! Unable to determine field applicability of customer comment present!","automation could output correction edits to fields without a corresponding QC mark?

This example confirms JSON includes corrections but since no edits made originally doesn't confirm whether all would be combined (probably are, just need another example to confirm)",Unsure,1,1,1
194028632849535149,Failing To Provide 1 Strong Or 2 Medium Indicators,https://apollo.geo.apple.com/tickets/kittyhawk-sig/194028632849535149,POI Morrow (Morrow Maintenance New),Tang's House,"
Verified via 3rd Party Sources: News/Wikipedia/Internet searches | Link: https://www.yelp.ca/biz/tangs-house-mississauga |
only this indicator is having the address hence rejecitng |
REJECT: Not Enough Information - Customer didn’t provide enough information |",Rejection Reason POI - Not Enough Information,Rejected,Closing Resolutions - Failing To Select Already Correct | Research And Comments Error - Failing To Provide 1 Strong Or 2 Medium Indicators,Rejected,Research And Comments Error - Failing To Provide 1 Strong Or 2 Medium Indicators | Closing Resolutions - Failing To Select Already Correct,"

",,,N/A,Failing To Select Already Correct | Failing To Provide 1 Strong Or 2 Medium Indicators,,Yes,N/A,Yes,Alexander,06/04/2025,Yes,No,No,"Editor failed to provide more than 1 medium indicators. L1 was able to find and comment 2 of them. Editor disputed as the names are slightly different between the two indicators, but it is clearly the same POI in both regardless. Dispute resolved in favor of L1","
Offline QC Disputed Rejected ticket! Offline QC Rejected ticket! No Corrections col! 'is wrong' suggestions only!","Morrow

Spam Customer Suggestions: spam phone correct",No,1,1,1
194029115371683843,Failing To Provide 1 Strong Or 2 Medium Indicators,https://apollo.geo.apple.com/tickets/kittyhawk-sig/194029115371683843,POI Change Details (Unspecified),Cochrane Plaza,"
Verified via Official Website | Link: 
https://www.facebook.com/pages/170%20Cochrane%20Plaza/126297827424032/|
customer suggsted phone number is invalid and not updated because it's an unofficial fb verify |
Reject Spam|",Rejection Reason POI - Spam,Rejected,Research And Comments Error - Failing To Provide 1 Strong Or 2 Medium Indicators,,,"

",Phone,,Phone,Failing To Provide 1 Strong Or 2 Medium Indicators,,No,N/A,Yes,Elvis,06/03/2025,Yes,No,No,Rejected customer added number due to FB spam,"
Offline QC Rejected ticket! 1 ""Removed"" Phone suggestions present!","Provided an invalid 1 digit number

Josh: ""Spam Customer Suggestions"" output logic correct",No,0,1,1
189525516817006592,Failing To Provide 1 Strong Or 2 Medium Indicators,https://apollo.geo.apple.com/tickets/kittyhawk-sig/189525516817006592,POI Change Details (Unspecified),GYM Crossfit & Fitness | Ho Chi Minh City,"
Verified via Official Website | Link: https://saigonsc.vn/crossfitq7/ | 404 not found

Verified via 3rd Party Sources: News/Wikipedia/Internet searches | Link: https://sosanhnha.com/diadiem/crossfit-q7-gZ4P2 | embedded map is different, not use it |

no indicators | Facebook: Do not use photos or reviews for editing POI | n cant verify issue for : +84 38 5604 394 | hence, | keep all current information 

REJECT: Not Enough Information - Customer didn't provide enough information |",Rejection Reason POI - Not Enough Information,Approved,,Rejected,Field Vendor Contributions Error - Failing To Merge Duplicates | Research And Comments Error - Failing To Provide 1 Strong Or 2 Medium Indicators,"

",Phone,Vendor Contributions,N/A,Failing To Provide 1 Strong Or 2 Medium Indicators,Failing To Merge Duplicates,No,N/A,Yes,William,06/03/2025,Yes,No,No,editor merged poi.,"
Offline QA QC Rejected ticket! 1 ""Removed"" Phone suggestions present!",Josh: May actually need to check for Vendor Contributions edits as applicable to Failing To Merge Duplicates non-procedural marking. Problem in testing code is that Vendor contributions doesn't show up in JSON as edited_field? BUT the dual Editor Edits scraping functionality should help,Unsure,0,1,1
189523882544201728,Failing To Provide 1 Strong Or 2 Medium Indicators,https://apollo.geo.apple.com/tickets/kittyhawk-sig/189523882544201728,POI Change Details (Unspecified),Dimanche David,"
Reviewed customer comments/photos/geotagged images | Curated as per Focus curation guideline | Customer correction is name | Verified via 3rd Party Sources: News/Wikipedia/Internet searches | Link: https://www.boulangeries-patisseries.fr/boulangeries/02057-beaurevoir/becfihdhebidhhcbccic.htm , https://www.franceboulangerie.fr/boulangeries/dimanche-david-beaurevoir | Updated customer correction name as alternate name | Complete |",Completion Reason POI - POI Changed,Rejected,Research And Comments Error - Failing To Provide 1 Strong Or 2 Medium Indicators,Rejected,,"

",Name,Name,N/A,Failing To Provide 1 Strong Or 2 Medium Indicators,,Yes,Yes,Yes,Josh,06/04/2025,Yes,No,Yes,"procedural only error, editor provided indicators for the NBP possible dupe, L1 gave leniency for not merging, does seem unclear if POI moved to nearby unit, but also invalid Hours Listing URL (procedural error)","
Offline QC Rejected ticket! 1 ""Removed"" Name suggestions present!",,,1,0,1
194027929781403648,Failing To Provide 1 Strong Or 2 Medium Indicators,https://apollo.geo.apple.com/tickets/kittyhawk-sig/194027929781403648,POI Change Details (Unspecified),Sercotel Encin Golf,"
[pafe_processor_todo_hours] Todo has reached maximum lifespan in NEEDS_TRIAGE status",Rejection Reason POI - Not Enough Information,Rejected,Research And Comments Error - Failing To Provide 1 Strong Or 2 Medium Indicators,,,"

",Hours,,N/A,Failing To Provide 1 Strong Or 2 Medium Indicators,,No,No,Yes,Alexander,06/04/2025,Yes,No,No,"Editor rejected hours suggestion edit with no indicators. L1 QC rejects and provides indicators. Editor accepts. 

Hours on POI don't seem right to me, and found indicators that show the front desk is open 24 hours, but no idea how the original POI hours were contributed. 4 hours for a golf course doesn't seem right","
Offline QC Rejected ticket!","Since this is a golf course, shouldn't this also have been an escalation as well? Potentially missed additional QC Marking? ",Unsure,0,1,1
194026873700745216,Failing To Provide 1 Strong Or 2 Medium Indicators,https://apollo.geo.apple.com/tickets/kittyhawk-sig/194026873700745216,POI Change Details (Unspecified),Swisspor Arena,"
Moved ToDo to existing record in nearby places |Reviewed customer comments/photos/geotagged images | Curated as per Focused Curation policies | ToDo Processed using language translator | Verified via Official Website | Link: http://www.fcl.ch/swissporarena | suggestion already correct via ow | REJECT: Already correct |",Rejection Reason POI - Already Correct,Rejected,Research And Comments Error - Failing To Provide 1 Strong Or 2 Medium Indicators,,,"
Das Stadion des FC Luzern
Heisst Swisspor Arena",Name | Comment,,N/A,Failing To Provide 1 Strong Or 2 Medium Indicators,,No,No,Yes,Elvis,06/03/2025,Yes,No,No,Duplicate | Reject already correct,"
Offline QC Rejected ticket! Editor moved ToDo from 40851468075403801! 1 ""Removed"" Name suggestions present! Unable to determine field applicability of customer comment present!",,No,0,1,1
194028673392705536,Failing To Provide 1 Strong Or 2 Medium Indicators,https://apollo.geo.apple.com/tickets/kittyhawk-sig/194028673392705536,POI Morrow (Morrow Maintenance New),Nmims Girl's Hostel,"
Special Project: Lookaround study
no OW FB found 
no 2 indicators found with poi name and address 
no store front image verified in lookaround view 
hence REJECT: Not Enough Information - Customer didn't provide enough information |",Rejection Reason POI - Not Enough Information,Rejected,Field URL Error - Unacceptable Or Unrelated Or Broken URL Or Not Most Concise Form Of URL Top | Field Address Error - Incorrect Country Specific Address Format | Field Name Error - Language Or Country Code Guideline Not Followed | Closing Resolutions - Failing To Select Complete | Research And Comments Error - Failing To Provide 1 Strong Or 2 Medium Indicators,,,"
Fully curate each POI and follow full curation Morrow Policy",Comment,Name | URL | Address,N/A,Failing To Select Complete | Failing To Provide 1 Strong Or 2 Medium Indicators,Unacceptable Or Unrelated Or Broken URL Or Not Most Concise Form Of URL Top | Incorrect Country Specific Address Format | Language Or Country Code Guideline Not Followed,Yes,N/A,No,William,06/03/2025,Yes,No,No,editor accepted qc suggestion.,"
Offline QC Rejected ticket! No Corrections col! 'is wrong' suggestions only! Unable to determine field applicability of customer comment present!",,Unsure,1,1,0
185020934115033094,Failing To Provide 1 Strong Or 2 Medium Indicators,https://apollo.geo.apple.com/tickets/kittyhawk-sig/185020934115033094,POI Change Details (Unspecified),Elinda Cafe Ve Restoran,"
Curated as per the focused curation guidelines | 
ToDo Processed using language translator |
Verified via 3rd Party Sources: News/Wikipedia/Internet searches | Link: https://tr.revieweuro.com/istanbul/elinda-cafe-restaurant-3949901 |
unable to verified correction address and no indicators found |
REJECT: Not Enough Information - Customer didn't provide enough information |",Rejection Reason POI - Not Enough Information,Rejected,Research And Comments Error - Failing To Provide 1 Strong Or 2 Medium Indicators,Rejected,,"

",Address,,N/A,Failing To Provide 1 Strong Or 2 Medium Indicators,,No,No,Yes,Josh,06/04/2025,Yes,No,No,,"
Offline QC Disputed Rejected ticket! Offline QC Rejected ticket! Flagged/Escalated ticket!",straightforward not enough indicators provided if script could output that (have a similar custom logic already). But again the project actually more interested with data outside the procedural markings,Unsure,0,1,1
198531000849924099,Failing To Provide 1 Strong Or 2 Medium Indicators,https://apollo.geo.apple.com/tickets/kittyhawk-sig/198531000849924099,POI Datascience (Ensemble Phantom),Patrick McGovern's Pub & Restaurant,"
Verified via Official Website | Link: http://www.patmcgoverns.com/ | Address listed in ow and no closer verify | Existing data is correct No need to edits Hence Rejecting Reject - Already Correct |",Rejection Reason POI - Already Correct,Rejected,Field URL Error - Hours Listing Issue | Field URL Error - Unacceptable Or Unrelated Or Broken URL Or Not Most Concise Form Of URL Top | Closing Resolutions - Failing To Select Complete | Research And Comments Error - Failing To Provide 1 Strong Or 2 Medium Indicators,,,"

",,URL,N/A,Hours Listing Issue | Failing To Select Complete | Failing To Provide 1 Strong Or 2 Medium Indicators,Unacceptable Or Unrelated Or Broken URL Or Not Most Concise Form Of URL Top,Yes,N/A,No,Alexander,06/04/2025,No,Yes,Yes,"Editor provided a single medium indicator (although they thought it was an official website). L1 rejects and provides official website in the form of the POI's official facebook page. 

Editor accepts and changes the URL and the Hours Listing URL. That being said, the hours on the OW do NOT match with the POI record attribute and needed to have been updated. 

Verified via Official Website | Link: https://www.facebook.com/people/Patrick-McGoverns-Pub/100063465163445/","
Offline QC Rejected ticket! No Corrections col! 'is wrong' suggestions only!",Hours listing potentially can be updated on official indicators between the time of flagging and automated review. How to handle in automation workflow if at all? Thinking it is outside our scope of pure data validation. ,No,0,1,1
194028226331284362,Failing To Provide 1 Strong Or 2 Medium Indicators,https://apollo.geo.apple.com/tickets/kittyhawk-sig/194028226331284362,POI Change Details (Unspecified),Skyline Attractions,"
sent to editor upon one or more processors' decision (poi_rap_pin_fsm::1e540cda-b06a-44df-8bcf-ed51df23742c)",Completion Reason POI - POI Changed,Rejected,Research And Comments Error - Failing To Provide 1 Strong Or 2 Medium Indicators | Research And Comments Error - Insufficient Comments Provided,Rejected,,"

",Geocode,Geocode,N/A,Failing To Provide 1 Strong Or 2 Medium Indicators | Insufficient Comments Provided,,Yes,Yes,Yes,Elvis,06/03/2025,Yes,No,No,Accepted,"
Offline QC Rejected ticket!",,No,1,0,1
198531816329576448,Failing To Provide 1 Strong Or 2 Medium Indicators,https://apollo.geo.apple.com/tickets/kittyhawk-sig/198531816329576448,POI Review (Moderncategory Cleanup),The Temple Bar,"
Verified via 3rd Party Sources: News/Wikipedia/Internet searches | Link: https://restaurantguru.com/The-Temple-Bar-Iluka-Western-Australia |
Updated the modern category (dining.restaurant.health_food_restaurant.vegetarian_restaurant.vegan_restaurant) |
Hence Complete |",Completion Reason POI - POI Changed,Approved,,Rejected,Research And Comments Error - Failing To Provide 1 Strong Or 2 Medium Indicators | Field Taxonomic Category Error - Missing Or Incorrect Top Category,"
Please reference the list of suggested categories to apply the Best Possible option while following guidelines. Categories = dining.restaurant , dining.bar.pub , dining.bar.bar_and_restaurant , dining.bar.wine_bar , dining.bar.cocktail_bar , dining.bar.bar_and_grill , dining.bar.lounge , dining.cafe , dining.bar.pub.gastropub",Modern Category | Comment,Modern Category,N/A,Failing To Provide 1 Strong Or 2 Medium Indicators,Missing Or Incorrect Top Category,Yes,N/A,No,William,06/04/2025,Yes,No,No,Accepted,"
Offline QA QC Rejected ticket! Unable to determine field applicability of customer comment present!",,Unsure,1,1,0
198533034685759488,Failing To Provide 1 Strong Or 2 Medium Indicators,https://apollo.geo.apple.com/tickets/kittyhawk-sig/198533034685759488,POI Change Details (Unspecified),Department of Motor Vehicles,"
Verified via 3rd Party Sources: News/Wikipedia/Internet searches | Link: https://www.yellowpages.com/el-segundo-ca/mip/motor-vehicle-department-470646901 | Reject: Already correct |",Rejection Reason POI - Already Correct,Rejected,Research And Comments Error - Failing To Provide 1 Strong Or 2 Medium Indicators,,,"

",Modern Category,,N/A,Failing To Provide 1 Strong Or 2 Medium Indicators,,No,No,Yes,Josh,06/04/2025,Yes,No,No,POI data already correct though suggestion not completely invalid,"
Offline QC Rejected ticket!",,,0,1,1
